{
  "id": "base:structure/house_small",
  "palette": [
    { "symbol": "#", "block": "planks" },
    { "symbol": ".", "block": "air" },
    { "symbol": "L", "block": "lamp" }
  ],
  "layers": [
    ["#######", "#######", "#######", "#######", "#######", "#######", "#######"],
    ["#######", "#.....#", "#.....#", "#.....#", "#.....#", "#.....#", "###.###"],
    ["#######", "#.....#", "#.....#", ".......", "#.....#", "#.....#", "###.###"],
    ["#######", "#.....#", "#.....#", "#..L..#", "#.....#", "#.....#", "#######"],
    ["#######", "#######", "#######", "#######", "#######", "#######", "#######"]
  ],
  "areas": [
    { "name": "main", "min": { "x": 1, "y": 1, "z": 1 }, "max": { "x": 5, "y": 3, "z": 5 } }
  ],
  "containers": [
    { "containerKind": "cabinet", "at": { "x": 1, "y": 1, "z": 1 }, "area": "main" },
    { "containerKind": "cabinet", "at": { "x": 5, "y": 1, "z": 5 }, "area": "main" }
  ]
}
