{
  "id": "base:structure/garage",
  "palette": [
    { "symbol": "#", "block": "planks" },
    { "symbol": ".", "block": "air" },
    { "symbol": "L", "block": "lamp" }
  ],
  "layers": [
    ["#########", "#########", "#########", "#########", "#########", "#########", "#########"],
    ["#########", "#.......#", "#.......#", "#.......#", "#.......#", "#.......#", "###...###"],
    ["#########", "#.......#", "#.......#", "........#", "#.......#", "#.......#", "###...###"],
    ["#########", "#.......#", "#.......#", "#...L...#", "#.......#", "#.......#", "#########"],
    ["#########", "#########", "#########", "#########", "#########", "#########", "#########"]
  ],
  "areas": [
    { "name": "bay", "areaType": "base:area_type/garage", "min": { "x": 1, "y": 1, "z": 1 }, "max": { "x": 7, "y": 3, "z": 5 } }
  ],
  "containers": [
    { "containerKind": "shelf", "at": { "x": 1, "y": 1, "z": 1 }, "area": "bay" },
    { "containerKind": "shelf", "at": { "x": 7, "y": 1, "z": 1 }, "area": "bay" },
    { "containerKind": "shelf", "at": { "x": 1, "y": 1, "z": 5 }, "area": "bay" }
  ]
}
