{
  "id": "base:structure/house_family",
  "palette": [
    { "symbol": "#", "block": "planks" },
    { "symbol": ".", "block": "air" },
    { "symbol": "L", "block": "lamp" }
  ],
  "layers": [
    ["###########", "###########", "###########", "###########", "###########", "###########", "###########"],
    ["###########", "#....#....#", "#....#....#", "#.........#", "#....#....#", "#....#....#", "##.########"],
    ["###########", "#....#....#", "#....#....#", "...........", "#....#....#", "#....#....#", "##.########"],
    ["###########", "#....#....#", "#....#....#", "#.L..#..L.#", "#....#....#", "#....#....#", "###########"],
    ["###########", "###########", "###########", "###########", "###########", "###########", "###########"]
  ],
  "areas": [
    { "name": "kitchen", "areaType": "base:area_type/kitchen", "min": { "x": 1, "y": 1, "z": 1 }, "max": { "x": 4, "y": 3, "z": 5 } },
    { "name": "bedroom", "areaType": "base:area_type/bedroom", "min": { "x": 6, "y": 1, "z": 1 }, "max": { "x": 9, "y": 3, "z": 5 } }
  ],
  "containers": [
    { "containerKind": "fridge", "at": { "x": 1, "y": 1, "z": 1 }, "area": "kitchen" },
    { "containerKind": "cabinet", "at": { "x": 4, "y": 1, "z": 1 }, "area": "kitchen" },
    { "containerKind": "wardrobe", "at": { "x": 9, "y": 1, "z": 1 }, "area": "bedroom" },
    { "containerKind": "cabinet", "at": { "x": 9, "y": 1, "z": 5 }, "area": "bedroom" }
  ]
}
